Symbol,Name,Last Sale,Net Change,% Change,Market Cap,Country,IPO Year,Volume,Sector,Industry
AFG,American Financial Group Inc. Common Stock,$127.39,-1.61,-1.248%,10803676088.00,United States,,421535,Finance,Property-Casualty Insurers
AFL,AFLAC Incorporated Common Stock,$61.90,0.42,0.683%,40948596756.00,United States,,3705306,Finance,Accident &Health Insurance
AIG,American International Group Inc. New Common Stock,$58.21,0.75,1.305%,50149412976.00,United States,,5445707,Finance,Life Insurance
AJG,Arthur J. Gallagher & Co. Common Stock,$153.20,-3.09,-1.977%,31754989600.00,United States,,2133653,Finance,Specialty Insurers
ALL,Allstate Corporation (The) Common Stock,$121.93,0.01,0.008%,34954409679.00,United States,,2038146,Finance,Property-Casualty Insurers
ALLY,Ally Financial Inc. Common Stock,$48.41,1.73,3.706%,16771354040.00,United States,2014,6170807,Finance,Diversified Financial Services
AMP,Ameriprise Financial Inc. Common Stock,$298.53,-2.43,-0.807%,33402467069.00,United States,,619723,Finance,Investment Managers
AMT,American Tower Corporation (REIT) Common Stock,$250.53,2.13,0.857%,114094793509.00,United States,,2008650,Finance,Trusts Except Educational Religious and Charitable
AON,Aon plc Class A Ordinary Shares (Ireland),$267.71,-5.94,-2.171%,58985188410.00,United States,,1534940,Finance,Specialty Insurers
ARCC,Ares Capital Corporation Common Stock,$21.26,0.36,1.722%,10146418743.00,United States,2004,4404210,Finance,Finance/Investors Services
AXP,American Express Company Common Stock,$173.11,14.18,8.922%,134083347787.00,United States,,13051902,Finance,Finance: Consumer Services
BAC,Bank of America Corporation Common Stock,$45.43,0.88,1.975%,391936083437.00,United States,,71286102,Finance,Major Banks
BEN,Franklin Resources Inc. Common Stock,$31.55,-0.14,-0.442%,15854520892.00,United States,,3653561,Finance,Investment Managers
BK,The Bank of New York Mellon Corporation Common Stock,$59.02,0.12,0.204%,47460637900.00,United States,,5919551,Finance,Investment Managers
BLK,BlackRock Inc. Common Stock,$798.55,11.73,1.491%,121127650288.00,United States,1999,1217145,Finance,Investment Bankers/Brokers/Service
BRO,Brown & Brown Inc. Common Stock,$64.42,-0.19,-0.294%,18193936968.00,United States,,3268996,Finance,Specialty Insurers
BX,Blackstone Inc. Common Stock,$110.24,0.85,0.777%,78370680808.00,United States,2007,6022116,Finance,Investment Managers
C,Citigroup Inc. Common Stock,$64.11,1.41,2.249%,127211372692.00,United States,,33999280,Finance,Major Banks
CBRE,CBRE Group Inc Common Stock Class A,$95.86,-4.89,-4.854%,32081069915.00,United States,,2488941,Finance,Real Estate
CFG,Citizens Financial Group Inc. Common Stock,$51.61,0.51,0.998%,21786500737.00,United States,2014,6668150,Finance,Major Banks
CG,The Carlyle Group Inc. Common Stock,$47.09,-0.95,-1.978%,16785801796.00,United States,2012,1478819,Finance,Investment Managers
CINF,Cincinnati Financial Corporation Common Stock,$115.09,-2.08,-1.775%,18545717460.00,United States,,595688,Finance,Property-Casualty Insurers
CMA,Comerica Incorporated Common Stock,$92.58,2.05,2.264%,12099090596.00,United States,,1656474,Finance,Major Banks
CME,CME Group Inc. Class A Common Stock,$221.79,-2.46,-1.097%,79711172300.00,United States,2002,1645223,Finance,Investment Bankers/Brokers/Service
CNA,CNA Financial Corporation Common Stock,$44.72,-0.47,-1.04%,12135213968.00,United States,,163216,Finance,Property-Casualty Insurers
COF,Capital One Financial Corporation Common Stock,$152.16,3.86,2.603%,64762652345.00,United States,1994,5422309,Finance,Finance Companies
CSGP,CoStar Group Inc. Common Stock,$67.04,-2.61,-3.747%,26476493954.00,United States,1998,2744079,Finance,Real Estate
DFS,Discover Financial Services Common Stock,$118.44,3.10,2.688%,34110720000.00,United States,,2361479,Finance,Finance: Consumer Services
EWBC,East West Bancorp Inc. Common Stock,$83.51,0.02,0.024%,11850694573.00,United States,,889978,Finance,Commercial Banks
FITB,Fifth Third Bancorp Common Stock,$44.92,-0.56,-1.231%,30658159683.00,United States,,7661117,Finance,Major Banks
FNF,FNF Group of Fidelity National Financial Inc. Common Stock,$50.07,-0.24,-0.477%,14246504072.00,United States,2014,2012697,Finance,Specialty Insurers
FRC,FIRST REPUBLIC BANK Common Stock,$169.70,-5.16,-2.951%,30424836746.00,United States,,2549379,Finance,Commercial Banks
GL,Globe Life Inc. Common Stock,$102.57,0.51,0.50%,10357439108.00,United States,,660022,Finance,Life Insurance
GS,Goldman Sachs Group Inc. (The) Common Stock,$341.55,-1.84,-0.536%,113933471632.00,United States,1999,3934116,Finance,Investment Bankers/Brokers/Service
HBAN,Huntington Bancshares Incorporated Common Stock,$15.52,-0.12,-0.767%,22449078584.00,United States,,17111619,Finance,Major Banks
HIG,Hartford Financial Services Group Inc. (The) Common Stock,$70.38,-0.20,-0.283%,23954068984.00,United States,,1709823,Finance,Property-Casualty Insurers
ICE,Intercontinental Exchange Inc. Common Stock,$123.95,-1.37,-1.093%,69833967447.00,United States,2005,2923411,Finance,Investment Bankers/Brokers/Service
IT,Gartner Inc. Common Stock,$277.60,-9.43,-3.285%,22829549176.00,United States,1993,645275,Finance,Diversified Commercial Services
JLL,Jones Lang LaSalle Incorporated Common Stock,$241.00,-8.35,-3.349%,12162886569.00,United States,,402281,Finance,Real Estate
JPM,JP Morgan Chase & Co. Common Stock,$146.53,1.58,1.09%,431398973000.00,United States,,18457467,Finance,Major Banks
KEY,KeyCorp Common Stock,$24.90,-0.09,-0.36%,23183351297.00,United States,,7944931,Finance,Major Banks
KKR,KKR & Co. Inc. Common Stock,$64.76,-0.65,-0.994%,37885197605.00,United States,,3302337,Finance,Investment Managers
L,Loews Corporation Common Stock,$58.32,-0.64,-1.085%,14794874908.00,United States,,799596,Finance,Property-Casualty Insurers
LNC,Lincoln National Corporation Common Stock,$68.00,1.44,2.163%,12288190716.00,United States,,2350418,Finance,Life Insurance
LPLA,LPL Financial Holdings Inc. Common Stock,$159.75,0.05,0.031%,12803541559.00,United States,2010,668985,Finance,Investment Bankers/Brokers/Service
MET,MetLife Inc. Common Stock,$65.43,0.02,0.031%,55037111428.00,United States,2000,5334521,Finance,Life Insurance
MKL,Markel Corporation Common Stock,$1187.82,-41.59,-3.383%,16235418339.00,United States,1986,91525,Finance,Property-Casualty Insurers
MKTX,MarketAxess Holdings Inc. Common Stock,$352.01,-13.21,-3.617%,13385702281.00,United States,2004,380421,Finance,Investment Bankers/Brokers/Service
MMC,Marsh & McLennan Companies Inc. Common Stock,$156.65,-1.31,-0.829%,79091859241.00,United States,,2904781,Finance,Specialty Insurers
MS,Morgan Stanley Common Stock,$99.04,0.96,0.979%,175498880000.00,United States,,16014317,Finance,Investment Bankers/Brokers/Service
MTB,M&T Bank Corporation Common Stock,$164.59,-2.04,-1.224%,21180192883.00,United States,,1493319,Finance,Major Banks
NDAQ,Nasdaq Inc. Common Stock,$174.98,-1.35,-0.766%,29260506435.00,United States,,1401089,Finance,Investment Bankers/Brokers/Service
NTRS,Northern Trust Corporation Common Stock,$115.40,-0.92,-0.791%,23964107904.00,United States,,1165263,Finance,Trusts Except Educational Religious and Charitable
PFG,Principal Financial Group Inc Common Stock,$72.62,0.46,0.637%,19249341426.00,United States,2001,1476533,Finance,Specialty Insurers
PGR,Progressive Corporation (The) Common Stock,$109.30,-0.58,-0.528%,63874920000.00,United States,,3371249,Finance,Property-Casualty Insurers
PNC,PNC Financial Services Group Inc. (The) Common Stock,$204.20,0.09,0.044%,85764000000.00,United States,,1696447,Finance,Major Banks
PRU,Prudential Financial Inc. Common Stock,$110.90,1.46,1.334%,41920200000.00,United States,2001,2227445,Finance,Life Insurance
RF,Regions Financial Corporation Common Stock,$23.22,0.25,1.088%,22135222506.00,United States,,16191128,Finance,Major Banks
RJF,Raymond James Financial Inc. Common Stock,$96.81,-0.83,-0.85%,20117087505.00,United States,,1583260,Finance,Investment Bankers/Brokers/Service
SBNY,Signature Bank Common Stock,$310.31,-3.86,-1.229%,18814841906.00,United States,2004,1112355,Finance,Major Banks
SCHW,Charles Schwab Corporation (The) Common Stock,$88.53,-0.18,-0.203%,167374813574.00,United States,,9108818,Finance,Investment Bankers/Brokers/Service
SIVB,SVB Financial Group Common Stock,$554.82,-15.19,-2.665%,32560938829.00,United States,,669017,Finance,Major Banks
SOFI,SoFi Technologies Inc. Common Stock  ,$12.76,-0.54,-4.06%,10350193905.00,United States,,71603819,Finance,Diversified Financial Services
STT,State Street Corporation Common Stock,$94.13,0.33,0.352%,34449962847.00,United States,,2843234,Finance,Investment Managers
SYF,Synchrony Financial Common Stock,$46.10,1.17,2.604%,25228648060.00,United States,2014,8304240,Finance,Diversified Financial Services
TFC,Truist Financial Corporation Common Stock,$63.03,0.73,1.172%,83692368540.00,United States,,7976324,Finance,Major Banks
TROW,T. Rowe Price Group Inc. Common Stock,$157.65,-1.67,-1.048%,36133132805.00,United States,1986,1597124,Finance,Investment Managers
TRV,The Travelers Companies Inc. Common Stock,$168.60,-0.23,-0.136%,41477064628.00,United States,,2209444,Finance,Property-Casualty Insurers
TW,Tradeweb Markets Inc. Class A Common Stock,$89.02,-0.56,-0.625%,17987642830.00,United States,2019,1660407,Finance,Investment Bankers/Brokers/Service
USB,U.S. Bancorp Common Stock,$57.41,0.60,1.056%,85196440000.00,United States,,8461168,Finance,Major Banks
WAL,Western Alliance Bancorporation Common Stock (DE),$110.63,-0.35,-0.315%,11527831084.00,United States,2005,738341,Finance,Major Banks
WFC,Wells Fargo & Company Common Stock,$53.59,0.27,0.506%,208240102224.00,United States,,40783010,Finance,Major Banks
WRB,W.R. Berkley Corporation Common Stock,$82.47,-0.89,-1.068%,14567537004.00,United States,,1009530,Finance,Property-Casualty Insurers
ZION,Zions Bancorporation N.A. Common Stock,$66.48,3.71,5.91%,10401691020.00,United States,,3825664,Finance,Major Banks
